{
  "schema": "beacon.publication-hub-source/v1",
  "schema_version": "1.0.0",
  "site": {
    "id": "no-fallback",
    "title": "Repository Subpath Hub",
    "description": "A canonical repository-subpath deployment without a technical fallback.",
    "language": "en",
    "stage": "draft",
    "publisher": "Beacon Fixtures",
    "canonical_base_url": "https://example.github.io/no-fallback/",
    "theme": "neutral"
  },
  "slots": []
}
