{
  "schema": "beacon.publication-hub-source/v1",
  "schema_version": "1.0.0",
  "site": {
    "id": "paper-only",
    "title": "Paper Only",
    "description": "A one-slot research publication fixture.",
    "language": "en",
    "stage": "published",
    "publisher": "Beacon Fixtures",
    "canonical_base_url": "https://paper.example.org/research/",
    "fallback_base_url": "https://example.github.io/paper-only/",
    "repository": "https://github.com/example/paper-only",
    "revision": "1111111111111111111111111111111111111111",
    "theme": "neutral"
  },
  "slots": [
    {
      "id": "paper",
      "kind": "research-paper",
      "title": "Reference paper",
      "summary": "A published paper with a byte-verified PDF.",
      "status": "available",
      "version": "1.0.0",
      "route": "paper/",
      "source": {
        "repository": "https://github.com/example/paper-only",
        "revision": "2222222222222222222222222222222222222222",
        "path": "paper"
      },
      "identifiers": [
        {
          "scheme": "doi",
          "value": "10.0000/example",
          "url": "https://doi.org/10.0000/example"
        }
      ],
      "artifacts": [
        {
          "id": "paper-pdf",
          "label": "Paper PDF",
          "source": "artifacts/paper.pdf",
          "path": "downloads/reference-paper.pdf",
          "media_type": "application/pdf"
        }
      ],
      "manifests": [
        {
          "id": "provenance",
          "label": "Provenance manifest",
          "source": "artifacts/provenance.json",
          "path": "metadata/provenance.json",
          "media_type": "application/json"
        }
      ],
      "preview": { "label": "Preview the paper", "resource_id": "paper-pdf" },
      "provenance": [
        { "label": "Build provenance", "resource_id": "provenance" }
      ],
      "accessibility": {
        "summary": "Tagged source and an accessible semantic landing page.",
        "features": ["semantic headings", "descriptive links"]
      }
    }
  ]
}
